{
  "schema_version": "v1",
  "root": "assistant",
  "requirements": {
    "models": {
      "primary": {
        "capabilities": [
          "chat"
        ]
      },
      "summary": {
        "capabilities": [
          "chat"
        ]
      }
    },
    "tools": {},
    "knowledge": {}
  },
  "nodes": {
    "assistant": {
      "kind": "llm",
      "instruction": "Answer",
      "model_slot": "primary",
      "tool_slots": [],
      "knowledge_slots": [],
      "memory": {
        "tools": [],
        "preload_limit": 0
      },
      "artifact": {
        "enabled": false
      },
      "add_session_summary": false
    }
  },
  "runtime": {
    "summary": {
      "enabled": false
    }
  }
}
